{
  "id": "cybercore.snippets",
  "version": "1.0.0",
  "kind": "snippet-pack",
  "channel": "stable",
  "license": "MIT",
  "compatibility": { "control_plane": ">=0.1.0" },
  "dependencies": [],
  "resources": [
    {
      "id": "snippet.theme-loader",
      "kind": "snippet-index",
      "path": "packs/cybercore/snippets/snippets.json",
      "sha256": "a4012e9373b7571b89a7c02e0bb8eed46afe874b735ddba200beb108ee154263"
    }
  ],
  "provenance": {
    "source": "https://github.com/cybercoretech/cybercore-packs",
    "author": "Cybercore Tech",
    "reviewed": true
  }
}
