{
  "id": "cybercore.svg-assets",
  "version": "1.0.0",
  "kind": "svg-pack",
  "channel": "stable",
  "license": "MIT",
  "compatibility": { "control_plane": ">=0.1.0", "web_kit": ">=1.0.0" },
  "dependencies": [],
  "resources": [
    {
      "id": "asset.cybercore-signal",
      "kind": "svg",
      "path": "packs/cybercore/svg-assets/assets.svg",
      "sha256": "0625af0ca93f013953e9ecfdc6f82763e19b67d15add065f748a69ec305dc0c7"
    }
  ],
  "provenance": {
    "source": "https://github.com/cybercoretech/cybercore-packs",
    "author": "Cybercore Tech",
    "reviewed": true
  }
}
